{
  "config_hash": "ae2371266cef",
  "consistency": {
    "cnn": {
      "gradcam": {
        "all": {
          "abs_spearman": {
            "ci_high": 0.880441,
            "ci_low": 0.833844,
            "mean": 0.858116,
            "n": 50
          }
        },
        "correct": {
          "abs_spearman": {
            "ci_high": 0.887981,
            "ci_low": 0.840089,
            "mean": 0.864855,
            "n": 43
          }
        }
      },
      "integrated_gradients": {
        "all": {
          "abs_spearman": {
            "ci_high": 0.576693,
            "ci_low": 0.538022,
            "mean": 0.556358,
            "n": 50
          }
        },
        "correct": {
          "abs_spearman": {
            "ci_high": 0.572751,
            "ci_low": 0.532768,
            "mean": 0.553256,
            "n": 43
          }
        }
      },
      "occlusion": {
        "all": {
          "abs_spearman": {
            "ci_high": 0.597694,
            "ci_low": 0.530248,
            "mean": 0.564514,
            "n": 50
          }
        },
        "correct": {
          "abs_spearman": {
            "ci_high": 0.606542,
            "ci_low": 0.538736,
            "mean": 0.573087,
            "n": 43
          }
        }
      }
    },
    "vit": {
      "integrated_gradients": {
        "all": {
          "abs_spearman": {
            "ci_high": 0.702348,
            "ci_low": 0.672511,
            "mean": 0.687833,
            "n": 50
          }
        },
        "correct": {
          "abs_spearman": {
            "ci_high": 0.700267,
            "ci_low": 0.664976,
            "mean": 0.682448,
            "n": 39
          }
        }
      },
      "occlusion": {
        "all": {
          "abs_spearman": {
            "ci_high": 0.854524,
            "ci_low": 0.773251,
            "mean": 0.815425,
            "n": 50
          }
        },
        "correct": {
          "abs_spearman": {
            "ci_high": 0.867101,
            "ci_low": 0.781046,
            "mean": 0.827019,
            "n": 39
          }
        }
      }
    }
  },
  "experiment": "full",
  "faithfulness": {
    "cnn": {
      "center": {
        "all": {
          "deletion_auc": {
            "ci_high": 0.473731,
            "ci_low": 0.437394,
            "mean": 0.45603,
            "n": 500
          },
          "insertion_auc": {
            "ci_high": 0.577976,
            "ci_low": 0.541929,
            "mean": 0.55947,
            "n": 500
          }
        },
        "correct": {
          "deletion_auc": {
            "ci_high": 0.506215,
            "ci_low": 0.471672,
            "mean": 0.488898,
            "n": 440
          },
          "insertion_auc": {
            "ci_high": 0.621908,
            "ci_low": 0.589536,
            "mean": 0.604774,
            "n": 440
          }
        },
        "curves": {
          "deletion_mean": [
            0.692076,
            0.694587,
            0.690718,
            0.679048,
            0.657272,
            0.637495,
            0.61616,
            0.593784,
            0.564992,
            0.535737,
            0.506104,
            0.474632,
            0.440809,
            0.407636,
            0.364163,
            0.306696,
            0.235767,
            0.17554,
            0.117282,
            0.058662,
            0.034946
          ],
          "fractions": [
            0.0,
            0.05,
            0.1,
            0.15,
            0.2,
            0.25,
            0.3,
            0.35,
            0.4,
            0.45,
            0.5,
            0.55,
            0.6,
            0.65,
            0.7,
            0.75,
            0.8,
            0.85,
            0.9,
            0.95,
            1.0
          ],
          "insertion_mean": [
            0.034946,
            0.215257,
            0.30135,
            0.38394,
            0.442029,
            0.502012,
            0.544832,
            0.578567,
            0.60326,
            0.629156,
            0.639963,
            0.650122,
            0.658102,
            0.662712,
            0.661734,
            0.658404,
            0.665753,
            0.674378,
            0.680205,
            0.674111,
            0.692076
          ]
        }
      },
      "gradcam": {
        "all": {
          "deletion_auc": {
            "ci_high": 0.343699,
            "ci_low": 0.312651,
            "mean": 0.32906,
            "n": 500
          },
          "insertion_auc": {
            "ci_high": 0.664066,
            "ci_low": 0.628945,
            "mean": 0.646408,
            "n": 500
          }
        },
        "correct": {
          "deletion_auc": {
            "ci_high": 0.375544,
            "ci_low": 0.341292,
            "mean": 0.357674,
            "n": 440
          },
          "insertion_auc": {
            "ci_high": 0.709124,
            "ci_low": 0.678745,
            "mean": 0.693844,
            "n": 440
          }
        },
        "curves": {
          "deletion_mean": [
            0.692076,
            0.644575,
            0.600519,
            0.558508,
            0.519398,
            0.486783,
            0.453421,
            0.410379,
            0.366764,
            0.324534,
            0.294157,
            0.265459,
            0.240604,
            0.218886,
            0.200227,
            0.183124,
            0.159065,
            0.132464,
            0.094041,
            0.064779,
            0.034946
          ],
          "fractions": [
            0.0,
            0.05,
            0.1,
            0.15,
            0.2,
            0.25,
            0.3,
            0.35,
            0.4,
            0.45,
            0.5,
            0.55,
            0.6,
            0.65,
            0.7,
            0.75,
            0.8,
            0.85,
            0.9,
            0.95,
            1.0
          ],
          "insertion_mean": [
            0.034946,
            0.345156,
            0.505674,
            0.584731,
            0.630238,
            0.666323,
            0.685111,
            0.691976,
            0.701146,
            0.706304,
            0.70519,
            0.706178,
            0.709073,
            0.707765,
            0.706008,
            0.704795,
            0.70645,
            0.703882,
            0.70176,
            0.696881,
            0.692076
          ]
        }
      },
      "integrated_gradients": {
        "all": {
          "deletion_auc": {
            "ci_high": 0.261308,
            "ci_low": 0.23613,
            "mean": 0.249001,
            "n": 500
          },
          "insertion_auc": {
            "ci_high": 0.32288,
            "ci_low": 0.29619,
            "mean": 0.309472,
            "n": 500
          }
        },
        "correct": {
          "deletion_auc": {
            "ci_high": 0.27707,
            "ci_low": 0.252114,
            "mean": 0.264754,
            "n": 440
          },
          "insertion_auc": {
            "ci_high": 0.342185,
            "ci_low": 0.317072,
            "mean": 0.329541,
            "n": 440
          }
        },
        "curves": {
          "deletion_mean": [
            0.692076,
            0.605357,
            0.543695,
            0.484208,
            0.433784,
            0.386908,
            0.34231,
            0.306744,
            0.273892,
            0.244541,
            0.215569,
            0.185932,
            0.154486,
            0.125875,
            0.099855,
            0.074173,
            0.0549,
            0.037465,
            0.0254,
            0.021409,
            0.034946
          ],
          "fractions": [
            0.0,
            0.05,
            0.1,
            0.15,
            0.2,
            0.25,
            0.3,
            0.35,
            0.4,
            0.45,
            0.5,
            0.55,
            0.6,
            0.65,
            0.7,
            0.75,
            0.8,
            0.85,
            0.9,
            0.95,
            1.0
          ],
          "insertion_mean": [
            0.034946,
            0.032307,
            0.038339,
            0.04937,
            0.069914,
            0.100124,
            0.136512,
            0.178623,
            0.227603,
            0.269347,
            0.308313,
            0.34839,
            0.384279,
            0.422737,
            0.458431,
            0.494335,
            0.534396,
            0.565496,
            0.592199,
            0.615205,
            0.692076
          ]
        }
      },
      "occlusion": {
        "all": {
          "deletion_auc": {
            "ci_high": 0.518472,
            "ci_low": 0.482611,
            "mean": 0.500717,
            "n": 500
          },
          "insertion_auc": {
            "ci_high": 0.596572,
            "ci_low": 0.558932,
            "mean": 0.576582,
            "n": 500
          }
        },
        "correct": {
          "deletion_auc": {
            "ci_high": 0.553752,
            "ci_low": 0.518324,
            "mean": 0.535943,
            "n": 440
          },
          "insertion_auc": {
            "ci_high": 0.63889,
            "ci_low": 0.60623,
            "mean": 0.622286,
            "n": 440
          }
        },
        "curves": {
          "deletion_mean": [
            0.692076,
            0.688098,
            0.679134,
            0.669928,
            0.660956,
            0.647264,
            0.635923,
            0.61567,
            0.598193,
            0.585303,
            0.564246,
            0.539696,
            0.509729,
            0.479765,
            0.443242,
            0.398976,
            0.342593,
            0.277237,
            0.19733,
            0.117537,
            0.034946
          ],
          "fractions": [
            0.0,
            0.05,
            0.1,
            0.15,
            0.2,
            0.25,